title	author	rating	genres	genre	pages	num_awards	awards	numRatings	ratingsByStars	likedPercent	bbeScore	bbeVotes																																																										
The Lightning Thief	Rick Riordan (Goodreads Author)	4.26	"['Fantasy', 'Young Adult', 'Mythology', 'Fiction', 'Middle Grade', 'Adventure', 'Childrens', 'Urban Fantasy', 'Greek Mythology', 'Magic']"	Fantasy	375	13	"[""Young Readers' Choice Award (2008)"", 'Books I Loved Best Yearly (BILBY) Awards for Older Readers (2011)', 'South Carolina Book Award for Junior Book Award (2008)', 'Grand Canyon Reader Award for Tween Book (2008)', 'Nene Award (2008)', ""Massachusetts Children's Book Award (2008)"", ""Pennsylvania Young Readers' Choice Award for Grades 6-8 (2008)"", 'Rhode Island Teen Book Award Nominee (2007)', 'Sunshine State Young Reade"						Readers' Book Awar	d (200	"9)""""]"","	"1992300,""["	'100688	"5', '"	60499	"9', '2893"	10	"', '"	64014	"', '27"	"092']"",95"	",597132,637"	0																																											
The Secret Garden	Frances Hodgson Burnett	4.13	"['Classics', 'Fiction', 'Childrens', 'Young Adult', 'Historical Fiction', 'Middle Grade', 'Literature', 'Fantasy', 'Historical', 'Audiobook']"	Classics	331	0	['Lewis Carroll Shelf Award (1958)']	891374	"['381307', '306569', '158245', '32814', '12439']"	95	585722	6445																																																										
A Thousand Splendid Suns	Khaled Hosseini (Goodreads Author)	4.38	"['Fiction', 'Historical Fiction', 'Contemporary', 'Novels', 'Historical', 'War', 'Adult Fiction', 'Adult', 'Drama', 'Literature']"	Fiction	372	4	"['British Book Award for Best Read of the Year (2008)', 'Book Sense Book of the Year Award for Adult Fiction (2008)', 'California Book Award for Fiction (Silver) (2007)', 'Exclusive Books Boeke Prize Nominee (2007)', 'Lincoln Award Nominee (2011)']"	1151288	"['624406', '376677', '119523', '21990', '8692']"	97	580722	6164																																																										
A Wrinkle in Time	Madeleine L'Engle	4	"['Fantasy', 'Fiction', 'Classics', 'Young Adult', 'Science Fiction', 'Childrens', 'Middle Grade', 'Time Travel', 'Adventure', 'Science Fiction Fantasy']"	Fantasy	218	3	"['Newbery Medal (1963)', ""Dorothy Canfield Fisher Children's Book Award Nominee (1964)"", 'Oklahoma Sequoyah Award (1965)', 'Margaret A. Edwards Award (1998)']"	1051535	"['425481', '327970', '200267', '63557', '34260']"	91	562789	6014																																																										
A Game of Thrones	George R.R. Martin	4.45	"['Fantasy', 'Fiction', 'Epic Fantasy', 'Adult', 'Science Fiction Fantasy', 'High Fantasy', 'Adventure', 'Dragons', 'Audiobook', 'Epic']"	Fantasy	835	3	"['Nebula Award Nominee for Best Novel (1997)', 'Locus Award for Best Fantasy Novel (1997)', 'World Fantasy Award Nominee for Best Novel (1997)', 'Premio Ignotus for Novela extranjera (2003)']"	2003043	"['1231600', '540493', '156705', '41880', '32365']"	96	562241	6007																																																										
The Adventures of Huckleberry Finn	"Mark Twain, Guy Cardwell (Notes), John Seelye (Introduction), Walter Trier (Ilustrator)"	3.82	"['Classics', 'Fiction', 'Historical Fiction', 'Literature', 'Young Adult', 'Adventure', 'School', 'Novels', 'Read For School', 'American']"	Classics	327		[]	1151767	"['348906', '397153', '288029', '85514', '32165']"	90	516841	5691																																																										
The Lovely Bones	Alice Sebold	3.82	"['Fiction', 'Mystery', 'Young Adult', 'Contemporary', 'Fantasy', 'Crime', 'Adult', 'Adult Fiction', 'Drama', 'Novels']"	Fiction	372	11	"['Bram Stoker Award for Best First Novel (2002)', 'Orange Prize Nominee for Fiction Longlist (2003)', 'British Book Award for Best Read of the Year (2004)', 'Book Sense Book of the Year Award for Adult Fiction (2003)', 'California Book Award for First Fiction (Silver) (2002)', 'South Carolina Book Award for Young Adult Book Award (2005)', 'Chicago Tribune Heartland Prize for Fiction (2002)', 'Iowa High School Book Award (2005)', 'Puddly Award for Fiction (2003)', 'El"																																																															
The Outsiders	S.E. Hinton (Goodreads Author)	4.1	"['Classics', 'Young Adult', 'Fiction', 'School', 'Realistic Fiction', 'Read For School', 'Coming Of Age', 'Historical Fiction', 'Contemporary', 'Teen']"	Classics	192	1	"['Books I Loved Best Yearly (BILBY) Awards for Secondary  (1991)', 'Margaret A. Edwards Award (1988)']"	938150	"['396850', '309135', '173456', '44305', '14404']"	94	509346	5512																																																										