title	author	rating	genres	genre	pages	num_awards	awards	numRatings	ratingsByStars	likedPercent	bbeScore	bbeVotes																																																										
The Hunger Games	Suzanne Collins	4.33	"['Young Adult', 'Fiction', 'Dystopia', 'Fantasy', 'Science Fiction', 'Romance', 'Adventure', 'Teen', 'Post Apocalyptic', 'Action']"	YoungAdult	374	40	"['Locus Award Nominee for Best Young Adult Book (2009)', 'Georgia Peach Book Award (2009)', 'Buxtehuder Bulle (2009)', 'Golden Duck Award for Young Adult (Hal Clement Award) (2009)', ""Grand Prix de l'Imaginaire Nominee for Roman jeunesse √©tranger (2010)"", 'Books I Loved Best Yearly (BILBY) Awards for Older Readers (2012)', ""West Australian Young Readers' Book Award (WAYRBA) for Older Readers (2010)"", ""Red House Children's Book Award for Older"						d for Young Adults	(2010	")"""", 'R"	hode Islan	d Teen	Book	Award	"(2010)',"	""""	"""Dor"	othy	Canfie	ld Fisher	Children's	Book	Award	(2010	")"""", 'Evergreen Teen Boo"	k Award (2	"011)',"	'Soaring	Eagle	Book Award (2	"009)',"	'M	ilwaukee	County	Teen	Book	Award	Nomi	"nee (2010)', '"	Sakura	Meda	l for	Middle	School B	ook	(2010)'	", 'Michigan Lib"	rary Associati	on T	humbs Up! Award	"(2009)',"	'F	"lorida Teens Read (2009)',"	'Deutscher Jugendliteraturpre	is	for	P	re	is	der	Jugen	dj	ury	(2010	")', 'Iowa High School Book Award (2011)', 'New Mexico Land of Enchantment Award for Young Adult (2011)', 'Eliot Rosewater Indiana High School Book Award (2010)', 'The Inky Awards for Silver Inky (2009)', 'California Young Readers Medal for Young Adult (2011)', 'Lincoln Award (2011)', 'Kinderboekwinkelprijs (2010)', 'Missouri Truman Readers Award (2011)', 'CYBILS Award for Young Adult Fantasy & Science Fiction (2008)', 'Literaturpreis der Jury der jungen Leser for Jugendbuch (2010)', 'The Inky Awards Shortlist for Silver Inky (2009)', 'Prix Et-lisez-moi (2011)', 'Missouri Gateway Readers Award (2011)', 'Oklahoma Sequoyah Award for High School and Intermediate (2011)', 'Premio El Templo de las Mil Puertas for Mejor novela extranjera perteneciente a saga (2009)', """"Rebecca Caudill Young Readers' Book Award (2011)"""", 'LovelyBooks Leserpreis for Fantasy (2009)', 'LovelyBooks Leserpreis for Bestes Cover/Umschlag (2009)', 'Premi Protagonista Jove for Categoria 13-14 anys (2010)']"",6376780,""['3444695', '1921313', '745221', '171994', '93557']"",96,2993816,30516"
Harry Potter and the Order of the Phoenix	"J.K. Rowling, Mary GrandPr√© (Illustrator)"	4.5	"['Fantasy', 'Young Adult', 'Fiction', 'Magic', 'Childrens', 'Adventure', 'Audiobook', 'Middle Grade', 'Classics', 'Science Fiction Fantasy']"	Fantasy	870	8	"['Bram Stoker Award for Works for Young Readers (2003)', 'Anthony Award for Young Adult (2004)', ""Mythopoeic Fantasy Award for Children's Literature (2008)"", 'Audie Award for Audiobook of the Year (2004)', 'Books I Loved Best Yearly (BILBY) Awards for Older Readers (2004)', 'Colorado Blue Spruce Young Adult Book Award (2006)', 'Golden Archer Award for Middle/Junior High (2005)', 'Deutscher"																																																															
To Kill a Mockingbird	Harper Lee	4.28	"['Classics', 'Fiction', 'Historical Fiction', 'School', 'Literature', 'Young Adult', 'Historical', 'Novels', 'Read For School', 'High School']"	Classics	324	3	"['Pulitzer Prize for Fiction (1961)', 'Audie Award for Classic (2007)', 'National Book Award Finalist for Fiction (1961)', 'Alabama Author Award for Fiction (1961)']"	4501075	"['2363896', '1333153', '573280', '149952', '80794']"	95	2269402	23328																																																										
Pride and Prejudice	"Jane Austen, Anna Quindlen (Introduction)"	4.26	"['Classics', 'Fiction', 'Romance', 'Historical Fiction', 'Literature', 'Historical', 'Novels', 'Historical Romance', 'Classic Literature', 'Adult']"	Classics	279		[]	2998241	"['1617567', '816659', '373311', '113934', '76770']"	94	1983116	20452																																																										
Twilight	Stephenie Meyer	3.6	"['Young Adult', 'Fantasy', 'Romance', 'Vampires', 'Fiction', 'Paranormal', 'Paranormal Romance', 'Supernatural', 'Teen', 'Urban Fantasy']"	YoungAdult	501	24	"['Georgia Peach Book Award (2007)', 'Buxtehuder Bulle (2006)', 'Kentucky Bluegrass Award for 9-12 (2007)', 'Prijs van de Kinder- en Jeugdjury Vlaanderen (2008)', 'Books I Loved Best Yearly (BILBY) Awards for Older Readers (2009)', ""West Australian Young Readers' Book Award (WAYRBA) for Older Readers (2008)"", 'Garden State Book Award for Fiction (Grades 9-12) (2008)', 'South Carolina Book Award for Young Adult Book Award (2008)', 'Grand Canyon Reader"						"Award (2007)"""", """	"""Penns"	ylvania	Young Rea	ders' C	hoice	Awar	d for You	ng	Adu	lt (2	"009)"""""	", 'Rhode"	Island Teen	Book	Award	(2007	")', 'Evergreen Teen Book"	Award (20	"08)',"	'Michigan	Libra	ry Association	Thumbs	U	p! Award	Nomine	e (20	"06)',"	'Teen	Read	Award Nominee	for B	est A	ll-Ti	me-Fave	"(2010)',"	'D	eutscher	Jugendliteratu	rpreis Nominee	for	Preis der Juge	ndjury (20	7	")', 'Iowa High School Book"	"Award (2008)', 'Eliot Rosewat"	er	Ind	ia	na	H	igh	School	B	ook	Award	"(2008)', 'Lincoln Award (2008)', 'Literaturpreis der Jury der jungen Leser for Cover (2007)', 'Prix Et-lisez-moi (2008)', 'Missouri Gateway Readers Award (2008)']"",4964519,""['1751460', '1113682', '1008686', '542017', '548674']"",78,1459448,14874"
The Book Thief	Markus Zusak (Goodreads Author)	4.37	"['Historical Fiction', 'Fiction', 'Young Adult', 'Historical', 'Classics', 'War', 'Holocaust', 'World War II', 'Books About Books', 'Audiobook']"	HistoricalFiction	552	19	"['National Jewish Book Award for Children‚Äôs and Young Adult Literature (2006)', ""Book Sense Book of the Year Award for Children's Literature (2007)"", 'Buxtehuder Bulle (2008)', 'Sydney Taylor Book Award for Teen Readers (2007)', 'Prijs van de Kinder- en Jeugdjury Vlaanderen (2009)', 'Michael L. Printz Award Nominee (2007)', 'Exclusive Books Boeke Prize (2007)', 'Rhode Island Teen Book Award Nominee (2008)', 'Th"						"(2006)', 'Lincoln"	Award	Nomine	"e (2010)',"	'Austr	alian	Book	Industry	A	ward	(ABI	A) Nom	inee for	Literary Fi	ction	(2008	")', 'K"	"athleen Mitchell Award',"	'Ena Noel	Award	"(2008)',"	'Lite	raturpreis der	Jury d	er	jungen	Leser f	or Ju	gendb	uch (2	009)'	", 'LovelyBooks"	Leser	preis	for	Allgeme	ine Liter	atu	r (2009)	"', 'Margaret A."	Edwards Award	(20	"14)']"",1834276,"	"""['1048230"	"',"	"'524674', '186297', '4886"	"4', '26211']"",96,1372809,14168"											
Animal Farm	"George Orwell, Russell Baker (Preface), C.M. Woodhouse (Introduction)"	3.95	"['Classics', 'Fiction', 'Dystopia', 'Fantasy', 'Literature', 'Politics', 'School', 'Science Fiction', 'Novels', 'Read For School']"	Classics	141	1	"['Prometheus Hall of Fame Award (2011)', 'Retro Hugo Award for Best Novella (1996)']"	2740713	"['986764', '958699', '545475', '165093', '84682']"	91	1276599	13264																																																										
The Chronicles of Narnia	"C.S. Lewis, Pauline Baynes (Illustrator)"	4.26	"['Fantasy', 'Classics', 'Fiction', 'Young Adult', 'Childrens', 'Christian', 'Adventure', 'Science Fiction Fantasy', 'Middle Grade', 'Christian Fiction']"	Fantasy	767		[]	517740	"['254964', '167572', '74362', '15423', '5419']"	96	1238556	12949																																																										
J.R.R. Tolkien 4-Book Boxed Set: The Hobbit and The Lord of the Rings	J.R.R. Tolkien	4.6	"['Fantasy', 'Fiction', 'Classics', 'Adventure', 'Science Fiction Fantasy', 'Epic Fantasy', 'High Fantasy', 'Young Adult', 'Literature', 'Magic']"	Fantasy	1728		[]	110146	"['78217', '22857', '6628', '1477', '967']"	98	1159802	12111																																																										
Gone with the Wind	Margaret Mitchell	4.3	"['Classics', 'Historical Fiction', 'Fiction', 'Romance', 'Historical', 'War', 'Literature', 'Civil War', 'Historical Romance', 'Novels']"	Classics	1037	1	"['Pulitzer Prize for Novel (1937)', 'National Book Award for Novel (1936)']"	1074620	"['602138', '275517', '133535', '39008', '24422']"	94	1087732	11211																																																										
The Fault in Our Stars	John Green (Goodreads Author)	4.21	"['Young Adult', 'Romance', 'Fiction', 'Contemporary', 'Realistic Fiction', 'Teen', 'Coming Of Age', 'Drama', 'Novels', 'Love']"	YoungAdult	313	27	"['Georgia Peach Book Award (2013)', 'Buxtehuder Bulle (2012)', 'Odyssey Award (2013)', 'Audie Award for Teens (2013)', ""West Australian Young Readers' Book Award (WAYRBA) for Older Readers (2013)"", ""Pennsylvania Young Readers' Choice Award for Young Adults (2013)"", 'Rhode Island Teen Book Award (2014)', 'Evergreen Teen Book Award (2015)', 'Soaring Eagle Book Award (2014)', 'Milwaukee County Teen Book Award (2013)', 'Indies Choice"						"nky (2012)', 'Cali"	fornia	Young	Readers Me	dal for	Youn	g Adu	lt (2015)	"',"	'Li	ncoln	Award	"(2014)',"	'Luisterbo	ek Aw	ard (2	"015)',"	'Goodreads Choice Award	for Young	Adult	Fiction	-2012	and Nominee f	or Best	o	f the Be	st  (20	"18)',"	'Gre	en Mou	ntain	Book Award (2	"014)',"	'The	Inky	Awards	Shortlis	t f	or Silve	"r Inky (2012)',"	"""""Louisiana T"	een	Readers' Choice	"(2015)"""","	'	Missouri Gateway Readers A	"ward (2015)', 'Oklahoma Sequoy"	ah	Awa	rd	f	or	Hig	h Scho	ol	(2	"015)',"	"'Alabama Author Award for Young Adult (2013)', 'Premio El Templo de las Mil Puertas for Mejor novela extranjera independiente (2012)', 'FAB Award Nominee (2014)', 'Premi Protagonista Jove for Categoria 15-16 anys (2013)']"",3550714,""['1784471', '1022406', '512574', '150365', '80898']"",93,1087056,11287"
The Hitchhiker's Guide to the Galaxy	Douglas Adams	4.22	"['Science Fiction', 'Fiction', 'Humor', 'Fantasy', 'Classics', 'Comedy', 'Science Fiction Fantasy', 'Audiobook', 'Adventure', 'Novels']"	ScienceFiction	193		[]	1436325	"['725771', '420864', '199846', '58326', '31518']"	94	1063601	10996																																																										
The Giving Tree	Shel Silverstein	4.37	"['Childrens', 'Picture Books', 'Classics', 'Fiction', 'Poetry', 'Young Adult', 'Fantasy', 'Juvenile', 'Kids', 'Short Stories']"	Childrens	64		[]	905731	"['556142', '204347', '94819', '27950', '22473']"	94	1021534	10594																																																										
Wuthering Heights	"Emily Bront√´, Richard J. Dunn (Editor), David Timson (Narrator), Charlotte Bront√´ (Commentary), Robert Heindel (Illustrator)"	3.86	"['Classics', 'Fiction', 'Romance', 'Gothic', 'Literature', 'Historical Fiction', '19th Century', 'Novels', 'Classic Literature', 'Historical']"	Classics	464		[]	1342664	"['483222', '413051', '279702', '107437', '59252']"	88	981502	10275																																																										
The Da Vinci Code	Dan Brown (Goodreads Author)	3.86	"['Fiction', 'Mystery', 'Thriller', 'Suspense', 'Mystery Thriller', 'Historical Fiction', 'Adventure', 'Novels', 'Crime', 'Adult']"	Fiction	489	8	"['British Book Award for Book of the Year (2005)', 'Book Sense Book of the Year Award for Adult Fiction (2004)', ""Humo's Gouden Bladwijzer (2004)"", 'Zilveren Vingerafdruk (2004)', ""The Flume: New Hampshire Teen Reader's Choice Award (2006)"", 'Teen Buckeye Book Award (2005)', 'Iowa High School Book Award (2006)', 'Puddly Award for Fiction (2007)', 'Missouri Gateway Readers Award for Adult (2006)']"	1933446	"['645308', '667657', '399278',"																																																													
Memoirs of a Geisha	Arthur Golden	4.12	"['Fiction', 'Historical Fiction', 'Romance', 'Historical', 'Classics', 'Japan', 'Adult', 'Novels', 'Asia', 'Adult Fiction']"	Fiction	503		[]	1717312	"['712950', '615702', '295184', '66518', '26958']"	95	862748	8993																																																										
The Picture of Dorian Gray	"Oscar Wilde, Jeffrey Eugenides (Introduction)"	4.08	"['Classics', 'Fiction', 'Horror', 'Fantasy', 'Literature', 'Gothic', 'Novels', '19th Century', 'LGBT', 'Classic Literature']"	Classics	272		[]	966196	"['382985', '350778', '176188', '41869', '14376']"	94	861799	9096																																																										
Alice's Adventures in Wonderland & Through the Looking-Glass	"Lewis Carroll, John Tenniel (Illustrator), Martin Gardner (Introduction)"	4.06	"['Classics', 'Fantasy', 'Fiction', 'Childrens', 'Young Adult', 'Literature', 'Adventure', 'Novels', '19th Century', 'British Literature']"	Classics	239		[]	458299	"['183179', '155059', '91573', '21360', '7128']"	94	833791	8812																																																										
Jane Eyre	"Charlotte Bront√´, Michael Mason (Editor), Barnett Freedman (Illustrator)"	4.13	"['Classics', 'Fiction', 'Romance', 'Historical Fiction', 'Literature', 'Gothic', 'Historical', '19th Century', 'School', 'Classic Literature']"	Classics	532		[]	1624682	"['746070', '501478', '256972', '76970', '43192']"	93	826759	8740																																																										
Les Mis√©rables	"Victor Hugo, Lee Fahnestock (Translator), Norman MacAfee (Translator)"	4.18	"['Classics', 'Fiction', 'Historical Fiction', 'Literature', 'France', 'Historical', 'Novels', 'French Literature', 'Romance', 'Classic Literature']"	Classics	1463		[]	682793	"['332692', '202012', '100932', '29673', '17484']"	93	813088	8548																																																										
Fahrenheit 451	Ray Bradbury	3.99	"['Classics', 'Fiction', 'Science Fiction', 'Dystopia', 'School', 'Literature', 'Novels', 'Fantasy', 'Adult', 'Science Fiction Fantasy']"	Classics	194	3	"['Prometheus Hall of Fame Award (1984)', 'Geffen Award for Best Translated SF Book (2002)', 'California Book Award for Fiction (Silver) (1953)', 'Retro Hugo Award for Best Novel (2004)']"	1680139	"['612098', '604888', '331815', '91160', '40178']"	92	793757	8537																																																										
Divergent	Veronica Roth (Goodreads Author)	4.19	"['Young Adult', 'Dystopia', 'Fiction', 'Fantasy', 'Science Fiction', 'Romance', 'Adventure', 'Teen', 'Post Apocalyptic', 'Action']"	YoungAdult	487	19	"['Georgia Peach Book Award (2012)', 'South Carolina Book Award for Young Adult (2014)', 'Rhode Island Teen Book Award (2013)', 'Evergreen Teen Book Award (2014)', 'Soaring Eagle Book Award (2012)', 'Milwaukee County Teen Book Award Nominee (2012)', ""Children's Choice Book Award Nominee for Teen Choice Book of the Year (2012)"", 'Sakura Medal', 'New Mexico Land of Enchantment Award for Young Adult (2014)', 'Eliot Rosewater Indiana High Sch"						Science Fiction an	d Nomi	nee for	Goodreads	Author	(201	"1)',"	'Green Mo	un	tain	Book	Award	"(2013)',"	'The Magno	lia A	ward f	or 6-8	"(2014)', """"Louisiana Te"	en Readers	' Choi	ce (2014)	""""", 'M"	issouri Gatewa	y Reade	rs	Award (	"2014)',"	'Okl	ahoma	Sequo	yah A	ward for High	Schol	(2014	")', '"	Premio	El Templo	de	las Mil	Puertas Nomine	e for Mejor no	vela	extranjera per	teneciente	a	"saga (2011)']"",2906258,""["	"'1409189', '882493', '434381',"	'	1232	86	"',"	'	5690	"9']"",9"	"4,"	793	"269,83"	39
Lord of the Flies	William Golding	3.69	"['Classics', 'Fiction', 'Young Adult', 'School', 'Literature', 'Dystopia', 'Read For School', 'Novels', 'High School', 'Adventure']"	Classics	182		[]	2263259	"['617568', '763438', '555614', '205804', '120835']"	86	773560	8230																																																										
Romeo and Juliet	"William Shakespeare, Paul Werstine (Editor), Barbara A. Mowat (Editor), Paavo Emil Cajander (Translator)"	3.75	"['Classics', 'Plays', 'Fiction', 'Romance', 'School', 'Drama', 'Read For School', 'Literature', 'High School', 'Poetry']"	Classics	301		[]	2055102	"['616589', '635380', '545898', '184612', '72623']"	87	771784	8282																																																										
The Alchemist	"Paulo Coelho (Goodreads Author), Alan R. Clarke (Translator), James Noel Smith (Illustrator)"	3.88	"['Fiction', 'Classics', 'Fantasy', 'Philosophy', 'Novels', 'Spirituality', 'Literature', 'Self Help', 'Inspirational', 'Adventure']"	Fiction	182	3	"['NBDB National Book Award Nominee for Translation (2015)', 'Grand Prix des lectrices de Elle for roman (1995)', 'Premio Grinzane Cavour for Narrativa Straniera (1996)', 'Corine Internationaler Buchpreis for Belletristik (2002)']"	2107732	"['805221', '613564', '414410', '172160', '102377']"	87	765587	8008																																																										
Crime and Punishment	"Fyodor Dostoyevsky, David McDuff (Translator)"	4.22	"['Classics', 'Fiction', 'Russia', 'Literature', 'Russian Literature', 'Novels', 'Philosophy', 'Crime', '19th Century', 'School']"	Classics	671		[]	626897	"['315090', '188181', '84074', '26493', '13059']"	94	759066	7937																																																										
The Perks of Being a Wallflower	Stephen Chbosky	4.2	"['Young Adult', 'Fiction', 'Contemporary', 'Coming Of Age', 'Romance', 'Realistic Fiction', 'LGBT', 'Classics', 'Mental Health', 'Teen']"	YoungAdult	213		[]	1250155	"['599617', '392068', '188162', '50631', '19677']"	94	758416	7979																																																										
The Great Gatsby	"F. Scott Fitzgerald, Francis Scott Fitzgerald"	3.92	"['Classics', 'Fiction', 'School', 'Literature', 'Historical Fiction', 'Romance', 'Novels', 'Read For School', 'High School', 'American']"	Classics	200	0	['Grammy Award Nominee for Best Spoken Word Album (2003)']	3775504	"['1345866', '1266424', '798955', '252115', '112144']"	90	755074	8142																																																										
City of Bones	Cassandra Clare (Goodreads Author)	4.1	"['Fantasy', 'Young Adult', 'Paranormal', 'Romance', 'Urban Fantasy', 'Fiction', 'Vampires', 'Supernatural', 'Angels', 'Magic']"	Fantasy	485	4	"['Locus Award Nominee for Best First Novel (2008)', 'Georgia Peach Book Award Nominee for Honor book (2009)', 'South Carolina Book Award Nominee for Young Adult Book Award (2010)', ""Pacific Northwest Library Association Young Reader's Choice Award (2010)"", 'Lincoln Award (2010)']"	1617465	"['745774', '465337', '271968', '87611', '46775']"	92	721821	7601																																																										
Ender's Game	"Orson Scott Card, Stefan Rudnicki (Narrator), Harlan Ellison (Narrator)"	4.3	"['Science Fiction', 'Fiction', 'Young Adult', 'Fantasy', 'Classics', 'Science Fiction Fantasy', 'Dystopia', 'War', 'Audiobook', 'Adventure']"	ScienceFiction	324	3	"['Hugo Award for Best Novel (1986)', 'Nebula Award for Best Novel (1985)', 'N√©bula (1985)', 'Margaret A. Edwards Award (2008)']"	1131303	"['603209', '339819', '132305', '35667', '20303']"	95	720651	7515																																																										
The Help	Kathryn Stockett (Goodreads Author)	4.47	"['Fiction', 'Historical Fiction', 'Historical', 'Adult', 'Adult Fiction', 'Contemporary', 'Audiobook', 'Classics', 'Chick Lit', 'Book Club']"	Fiction	451	9	"['Orange Prize Nominee for Fiction Longlist (2010)', 'Audie Award for Fiction (2010)', 'Exclusive Books Boeke Prize (2009)', 'SIBA Book Award for Fiction (2010)', 'Indies Choice Book Award for Adult Debut (2010)', 'Puddly Award for Fiction (2011)', 'Lincoln Award Nominee (2013)', 'Grand Prix des lectrices de Elle for roman (2011)', 'Goodreads Choice Award for Fiction (2009) and Nominee for Best of the Best  (2018)', 'Townsend Prize"																																																															
Anne of Green Gables	L.M. Montgomery	4.26	"['Classics', 'Fiction', 'Young Adult', 'Childrens', 'Historical Fiction', 'Middle Grade', 'Historical', 'Audiobook', 'Canada', 'Coming Of Age']"	Classics	320		[]	727685	"['379818', '208919', '100304', '25501', '13143']"	95	695453	7340																																																										
Harry Potter and the Sorcerer's Stone	"J.K. Rowling, Mary GrandPr√© (Illustrator)"	4.47	"['Fantasy', 'Fiction', 'Young Adult', 'Magic', 'Childrens', 'Middle Grade', 'Adventure', 'Classics', 'Audiobook', 'Science Fiction Fantasy']"	Fantasy	309	27	"[""Mythopoeic Fantasy Award for Children's Literature (2008)"", ""British Book Award for Children's Book of the Year (1998)"", 'Prijs van de Nederlandse Kinderjury for 6-9 jaar en 10-12 jaar (2002)', 'American Booksellers Book Of The Year  Award for Children (1999)', 'Audie Award (2000)', ""West Australian Young Readers' Book Award (WAYRBA) for Younger Readers (2000)"", 'South Carolina Book Aw"						ard for Chapter Bo	ok (20	"01)', """	"""Nevada Yo"	ung Rea	ders'	Awar	d for You	ng	Rea	der C	ategor	"y (2000)"""	""", 'Golden"	Arche	r Awar	d for	Middle/Junior High (2000	")', 'India"	n Pain	tbrush Bo	ok Awa	"rd (2000)', 'H"	otze de	R	oosprijs	-2002	"', 'N"	estl√	© Smar	ties	Book Prize for	9‚Äì1	1 yea	rs (1	"997)',"	'Eliot Ro	sew	ater Ind	iana High Schoo	l Book Award (	2001	")', 'Kinderboek"	winkelprij	s	"(1999)', 'Parenting Book o"	"f the Year Award (1998)', 'Nor"	th	Eas	t	Te	en	age	Book A	wa	rd	-1999	"', """"Specsavers National Book Award for Children's Book of the Year (1998)"""", 'Washington State Sasquatch Award (2000)', 'Literaturpreis der Jury der jungen Leser for Kinderbuch (1999)', 'Carnegie Medal Nominee (1997)', """"Rebecca Caudill Young Readers' Book Award (2001)"""", 'Premi Protagonista Jove for Categoria 12-13 anys (2000)']"",7048471,""['4578137', '1611874', '600384', '139551', '118525']"",96,691430,7348"
The Little Prince	"Antoine de Saint-Exup√©ry, Richard Howard (Translator), Ivan Minatti (Translator), Nguy·ªÖn Th√†nh V≈© (Illustrator)"	4.31	"['Classics', 'Fiction', 'Fantasy', 'Childrens', 'France', 'Young Adult', 'Philosophy', 'Literature', 'French Literature', 'Middle Grade']"	Classics	93	0	['Retro Hugo Award for Best Novella (2019)']	1363048	"['765471', '352384', '170246', '50086', '24861']"	95	690461	7388																																																										
Charlotte's Web	"E.B. White, Garth Williams (Illustrator), Rosemary Wells (Illustrations)"	4.17	"['Classics', 'Childrens', 'Fiction', 'Young Adult', 'Fantasy', 'Animals', 'Middle Grade', 'Juvenile', 'School', 'Chapter Books']"	Classics	184	4	"['Newbery Medal Nominee (1953)', ""George C. Stone Center for Children's Books Recognition of Merit Award (1970)"", 'Audie Award Nominee for Audiobook of the Year and Middle Grade (2020)', ""Massachusetts Children's Book Award (1984)"", 'Laura Ingalls Wilder Award (1970)']"	1417302	"['667602', '435898', '234523', '52346', '26933']"	94	681142	7358																																																										
Of Mice and Men	John Steinbeck	3.88	"['Classics', 'Fiction', 'School', 'Historical Fiction', 'Literature', 'Read For School', 'Novels', 'High School', 'American', 'Classic Literature']"	Classics	103	0	"[""New York Drama Critics' Circle Award for Best American Play (1938)""]"	1942168	"['634457', '681382', '437709', '132901', '55719']"	90	667925	7218																																																										
The Time Traveler's Wife	Audrey Niffenegger (Goodreads Author)	3.97	"['Fiction', 'Romance', 'Fantasy', 'Time Travel', 'Science Fiction', 'Contemporary', 'Adult', 'Chick Lit', 'Adult Fiction', 'Magical Realism']"	Fiction	500	5	"['Arthur C. Clarke Award Nominee (2005)', 'Orange Prize Nominee for Fiction Longlist (2004)', 'British Book Award (2006)', 'John W. Campbell Memorial Award Nominee for Best Science Fiction Novel (2005)', 'Exclusive Books Boeke Prize (2005)', 'ALA Alex Award (2004)']"	1573857	"['611265', '511614', '302023', '97893', '51062']"	91	666335	6969																																																										
Dracula	"Bram Stoker, Nina Auerbach (Editor), David J. Skal (Editor)"	4	"['Classics', 'Horror', 'Fiction', 'Fantasy', 'Vampires', 'Gothic', 'Paranormal', 'Literature', 'Audiobook', 'Supernatural']"	Classics	488		[]	938325	"['345260', '329217', '197206', '48642', '18000']"	93	646782	6988																																																										
Brave New World	Aldous Huxley	3.99	"['Classics', 'Fiction', 'Science Fiction', 'Dystopia', 'Literature', 'Novels', 'School', 'Fantasy', 'Philosophy', 'Science Fiction Fantasy']"	Classics	288		[]	1441287	"['527202', '517142', '283812', '78322', '34809']"	92	636202	6835																																																										
One Hundred Years of Solitude	"Gabriel Garc√≠a M√°rquez, Gregory Rabassa (Translator)"	4.08	"['Fiction', 'Classics', 'Magical Realism', 'Literature', 'Novels', 'Fantasy', 'Historical Fiction', 'Spanish Literature', 'Literary Fiction', 'Latin American']"	Fiction	417	1	"['Premio Internacional de Novela R√≥mulo Gallegos (1972)', 'Prix du Meilleur Livre √âtranger for Roman (1969)']"	753470	"['361401', '202144', '111026', '46474', '32425']"	90	621264	6543																																																										
The Catcher in the Rye	J.D. Salinger	3.81	"['Classics', 'Fiction', 'Young Adult', 'Literature', 'School', 'Novels', 'Coming Of Age', 'American', 'High School', 'Read For School']"	Classics	277	1	"['Teen Read Award Nominee for Best All-Time-Fave (2010)', 'National Book Award Finalist for Fiction (1952)']"	2736523	"['937208', '846027', '579292', '234980', '139016']"	86	603268	6533																																																										
The Princess Bride	William Goldman	4.26	"['Fantasy', 'Fiction', 'Classics', 'Romance', 'Humor', 'Young Adult', 'Adventure', 'Science Fiction Fantasy', 'Comedy', 'Fairy Tales']"	Fantasy	456		[]	779597	"['403082', '230637', '103925', '26081', '15872']"	95	601669	6413																																																										
